{
  "$schema": "../../../../benchmark-kit/schemas/tool.schema.json",
  "schemaVersion": 1,
  "kind": "benchmark-tool",
  "id": "ghostscript-pdfwrite-macos-10.07.1",
  "vendor": "Artifex Software",
  "product": "Ghostscript pdfwrite",
  "version": "10.07.1",
  "platform": "macOS 26.3 arm64; Homebrew",
  "synthetic": false,
  "acquisition": {
    "source": "Homebrew ghostscript formula; https://github.com/ArtifexSoftware/ghostpdl",
    "license": "AGPL-3.0-or-later or commercial Artifex license",
    "executable": "/opt/homebrew/bin/gs"
  },
  "adapter": {
    "kind": "command",
    "executable": "/opt/homebrew/bin/gs",
    "args": ["-q", "-dBATCH", "-dNOPAUSE", "-sDEVICE=pdfwrite", "-sOutputFile={output}", "{input}"],
    "outputFile": "recovered.pdf"
  }
}
