{
  "$schema": "../../../../benchmark-kit/schemas/tool.schema.json",
  "schemaVersion": 1,
  "kind": "benchmark-tool",
  "id": "recovery-toolbox-online-2026-08-11",
  "vendor": "Recovery Toolbox",
  "product": "Online Repair Service for corrupted files",
  "version": "web capture 2026-08-11",
  "platform": "Browser service",
  "synthetic": false,
  "acquisition": {
    "source": "https://online.recoverytoolbox.com/",
    "capturedAt": "2026-08-11",
    "supportedCohort": "PDF",
    "retention": "30-day automatic deletion stated on the live Recovery Toolbox page"
  },
  "adapter": {
    "kind": "guided",
    "instructions": [
      "Use only corpus-pdf.json and public benchmark inputs in the signed-in benchmark session.",
      "Run every PDF case in packet order and record the exact Recovery Toolbox service identity shown at upload time.",
      "Download and list every returned PDF in display order, including unchanged copies.",
      "Record the exact success, refusal, error, account, paywall, preview-only, or no-output message without recording an email address.",
      "Record the 30-day retention notice and any available deletion action after each upload."
    ]
  }
}
