{
  "$schema": "../../../../benchmark-kit/schemas/tool.schema.json",
  "schemaVersion": 1,
  "kind": "benchmark-tool",
  "id": "wondershare-repairit-macos-4.1.0",
  "vendor": "Wondershare",
  "product": "Repairit",
  "version": "4.1.0 installer capture",
  "platform": "macOS 26.3 arm64",
  "synthetic": false,
  "acquisition": {
    "source": "Official Wondershare DMG downloaded 2026-08-11",
    "filename": "Wondershare_Repairit_Installer.dmg",
    "byteLength": 2113821,
    "sha256": "a8f780d62be7f7ba78b0b144bd8198c55b209c9248af8d6af2ddfd8fc28e6552",
    "inspectedBundle": "Wondershare Repairit Installer.app 4.1.0 universal",
    "versionPolicy": "Confirm the installed product version before capture; create a new tool definition if it differs."
  },
  "adapter": {
    "kind": "guided",
    "instructions": [
      "Confirm the installed product identity and version, plan/license state, and macOS build before opening a packet input.",
      "Use standard file repair only; disable AI enhancement, upscaling, recoloring, and advanced repair that requests a healthy sample.",
      "Run every case in packet order without overwriting the packet input.",
      "Save and list every returned file in display order; mark recommended only when Repairit identifies a default or recommended result.",
      "Record refusals, errors, preview-only results, export paywalls, watermarks, and no-output outcomes exactly as observed."
    ]
  }
}
